{
  "$schema": "../../../../../packages/controller/scenarios/pme-scenario-2.schema.json",
  "schema": "pme-scenario/2",
  "id": "showcase-mh-v2",
  "title": "Malignant hyperthermia (phases)",
  "category": "Showcase",
  "durationMin": 40,
  "story": "A fit 35-year-old man on the table, breathing room air: premedicated with midazolam and fentanyl, preoxygenated, induced with propofol and succinylcholine, intubated and maintained on sevoflurane 2 %. The jaw is stiff after the succinylcholine. Minutes into surgery the EtCO₂ rises at unchanged ventilation when it should be falling (42 → 45; without MH it settles at 36–39), with a rising heart rate (64 → 80, blunted by fentanyl); untreated on this build, the core temperature rises slowly (about 37.3 °C at 51 minutes) and the established state comes only after about 100 minutes; the arrest branch is not reached on the demo path. Run the MH crisis: trigger off with a propofol infusion in its place, oxygen, hyperventilation, dantrolene (again if the EtCO₂ climbs back), cooling above 38.5 °C and the potassium.",
  "briefing": {
    "text": "You are the anaesthesia resident in theatre. A fit 35-year-old man, 80 kg, is on the table for elective surgery: awake, monitored, breathing room air. He will be premedicated with midazolam and fentanyl, preoxygenated, induced with propofol and succinylcholine, intubated, and maintained on sevoflurane 2 % with the ventilator at 12 × 500; then surgery begins.\n\nWatch the monitor. Say what you see as it changes, and what you would do about it.",
    "estimatedMinutes": 25,
    "durationS": 60,
    "lang": "en"
  },
  "takeHome": [
    "A rising EtCO₂ at the same ventilation with a rising heart rate: think of MH early.",
    "Trigger off, 100 % oxygen at high flow, hyperventilation, and dantrolene 2.5 mg/kg.",
    "Keep hyperventilating until the EtCO₂ stays down; if it climbs again, repeat dantrolene.",
    "After the crisis: ICU 24–48 h, dantrolene 1 mg/kg every 4–6 h for 24 h (recrudescence in about 20 %, mostly within the first day), then referral for testing and family counselling."
  ],
  "notes": "pme-scenario/2 translation of showcase-mh (F8; the owner's phase table of 31 October). PHASES are regions of the MH course, each entered by its own rule on engine truth and held 60 s before it changes (owner, Q1), except Early signs, held 20 s (the owner's ruling of 1 November: the /1 card's own settle for its early signs), and Arrest and ROSC, at once (D4); no button moves a phase. ACTIONS are the team's: the induction sequence (offered in Baseline, recorded, not graded: the orchestrator's call), the call of the crisis, the treatments and the return to normal ventilation, each with its acceptance criteria. The MH starts at the Induce press as on the /1 card: a card-set script entry (condition mh, severity 1) on the Induce action's first taking, in the press's stage group, so the engine receives the /1 card's commands at the /1 card's ticks (F8 step a; the susceptibility model, step b, is not in this card). Thresholds marked [ENG] in the $comments are the orchestrator's engineering readings of the owner's words: activity above zero > 0.01, high > 0.8, low < 0.2; rising/falling: the least-squares slope over the plan's windows (EtCO₂ > 0.2 mmHg/min over 120 s; HR over 120 s, any sign; for Treated, a dose coming in: the dantrolene effect dantroleneE rising, its slope above 0.02/min over 60 s, false while the drug only decays (#242); for Recovering and Recrudescence, the owner's rules of 1 November, EtCO₂ rising = at least 1 mmHg/min over 120 s and not rising its negation, read at whatever ventilation is set); unchanged set ventilation: within 5 % of its value at the phase's start. Cool is offered only above 38.5 °C core; the saline is the /1 card's (21 °C, the whole 1.6 L): #216's refrigerated fluid and its stop at 38 °C need engine fields not on this base. Charcoal filters are not modelled (words only), as on the /1 card. The treatments are open from Latent: on the demo path Early signs is entered 20 s after its rule first held, at the /1 card's early signs (08:03), and the call comes 9 s later (08:12), in Early signs. A call inside the hold changes the ventilation; the runner latches the hold (D1), so a prompt call does not keep the case out of the phase.",
  "seed": 7,
  "mode": "modeled",
  "patient": {
    "ageY": 35,
    "sex": "M",
    "weightKg": 80,
    "heightCm": 180,
    "ageBand": "adult",
    "sensors": {
      "ecg": "on",
      "spo2": "on",
      "nibp": "on",
      "abp": "connected",
      "co2": "on",
      "temp": "on"
    }
  },
  "phases": [
    {
      "id": "baseline",
      "label": "Baseline",
      "initial": true,
      "cue": "normal course",
      "notes": "Oxygen is never implicit: he breathes room air until you give it (Preoxygenate).",
      "next": [
        "latent",
        "arrest"
      ]
    },
    {
      "id": "latent",
      "label": "Latent",
      "cue": "the monitor looks normal",
      "$comment": "[ENG] activity above zero = mhActivity > 0.01; signs below threshold = EtCO₂ ≤ 45.",
      "notes": "Say it: the jaw is hard to open after the succinylcholine (masseter rigidity). The monitor cannot show it. In practice a rigid jaw after succinylcholine means a non-triggering anaesthetic from now on and close watch of the EtCO₂; today the volatile stays to show the crisis. Masseter rigidity with a rising EtCO₂ makes two signs.",
      "enter": {
        "all": [
          {
            "value": {
              "var": "mhActivity",
              "op": ">",
              "value": 0.01
            }
          },
          {
            "value": {
              "var": "etco2",
              "op": "<=",
              "value": 45
            }
          }
        ]
      },
      "holdS": 60,
      "next": [
        "earlySigns",
        "treated",
        "arrest"
      ]
    },
    {
      "id": "earlySigns",
      "label": "Early signs",
      "cue": "EtCO₂ climbing, HR up",
      "$comment": "[ENG] rising = least-squares slope over 120 s: EtCO₂ > 0.2 mmHg/min (design §4's example), HR > 0/min; unchanged set ventilation = within 5 % over the same 120 s (design §4's leaf, decision D1: the ventilation in place when the rise began; it re-arms 120 s after a change). Held 20 s, not 60 (the owner's ruling of 1 November): 20 s is the /1 card's own settle for its early signs, its state machine's confirmation (EtCO₂ above 45 for 20 s before 'earlySigns'), not a number fitted to this run. With 60 s the strip read Early signs a minute after the rise began (08:43 on the demo path, 08:50 in the kit round) while the /1 card shows its early signs at 08:03; a team that waits for the strip then called about 40 s late, and the ventilation-back precondition (EtCO₂ under 40 for 120 s) sat on its edge (#242). With 20 s Early signs is entered at the /1 card's second. Every other hold stays 60 s; Arrest and ROSC keep none (D4). A call inside the hold changes the ventilation: the runner latches the hold (D1), so a prompt call does not keep the case out of the phase.",
      "notes": "The EtCO₂ is rising at unchanged ventilation when it should be falling, with a rising heart rate: think of MH early.",
      "enter": {
        "all": [
          {
            "value": {
              "var": "etco2",
              "op": ">",
              "value": 45
            }
          },
          {
            "slope": {
              "var": "etco2",
              "op": ">",
              "perMin": 0.2,
              "overS": 120
            }
          },
          {
            "unchanged": {
              "var": "setMinuteVentilationLMin",
              "withinPct": 5,
              "overS": 120
            }
          },
          {
            "slope": {
              "var": "hr",
              "op": ">",
              "perMin": 0,
              "overS": 120
            }
          }
        ]
      },
      "holdS": 20,
      "next": [
        "established",
        "treated",
        "arrest"
      ]
    },
    {
      "id": "established",
      "label": "Established",
      "cue": "fever, EtCO₂ above 60",
      "$comment": "[ENG] activity high = mhActivity > 0.8; acidosis = pH < 7.25.",
      "enter": {
        "any": [
          {
            "value": {
              "var": "tempCore",
              "op": ">",
              "value": 38.5
            }
          },
          {
            "all": [
              {
                "value": {
                  "var": "mhActivity",
                  "op": ">",
                  "value": 0.8
                }
              },
              {
                "value": {
                  "var": "ph",
                  "op": "<",
                  "value": 7.25
                }
              }
            ]
          }
        ]
      },
      "holdS": 60,
      "next": [
        "treated",
        "arrest"
      ]
    },
    {
      "id": "treated",
      "label": "Treated",
      "cue": "EtCO₂ falling with the ventilation held",
      "$comment": "[ENG] Treated = a dose coming in (proposal of 1 November, for the owner's ruling): the dantrolene effect dantroleneE rising, its least-squares slope over 60 s above 0.02/min (two hundredths of the 0–1 effect per minute); false while the drug only decays, so the second Treated needs the second dose. The signal is the engine's unrounded effect, so its resolution sets no floor; 0.02/min is set by the drug's course, with a margin on both sides: the second 2.5 mg/kg dose, on top of the first, raises the effect at most 0.049/min (2.5 times 0.02), and the first dose's rise, near its peak, tapers through 0.007/min one hold after Recrudescence is entered (14:59 + 60 s on the demo path; 0.02 is 2.9 times that). It replaces D2's dantroleneE > 0.2 with mhExcess falling, which held from 09:58 without a break, through the recrudescence.",
      "enter": {
        "slope": {
          "var": "dantroleneE",
          "op": ">",
          "perMin": 0.02,